chunk_id,report_name,page_number,chunk_text
1,RTC_Impact_Report_2023,1,Catalyzing Growth and Impact for Women in Tech 2023 Impact Report
2,RTC_Impact_Report_2023,2,Contents 3 Letter from Our Founder and CEO 4 Expanding Our Impact Globally 6 Our Community 9 2023 Impact 11 2023 Milestones and Big Moments 13 Programs and Events 14 2023 Partners 16 Our Vision for 2024 17 2023 Staff and Student Leaders 2 rewritingthecode.org
3,RTC_Impact_Report_2023,3,"Letter from Our Founder + CEO Dear Rewriting the Code Members, Partners, and Supporters, As I reflect on the past year, I address each of you with a deep sense of pride and gratitude, who have contributed immensely to our mission of advancing university and early- career women in technology. This year has been monumental for RTC, not just in our achievements but also in our address the gender gap in tech but also to ensure that our significant strides towards creating a more equitable efforts are inclusive and representative of all women. future for women in tech globally. To our members, your enthusiasm, talent, and resilience Our collective efforts have illuminated the path for inspire us daily. Your achievements are a testament to countless women, helping them navigate the challenges the potential that lies in a supportive and inclusive tech and triumphs of a career in technology. Your unwavering community. To our partners and supporters, your generous"
4,RTC_Impact_Report_2023,3,"support, dedication, and belief in our mission have been contributions and unwavering belief in our mission fuel our the cornerstone of our success. Together, we've built a progress. Together, we are not just rewriting the code; we community that not only supports but empowers women are redefining the future of technology to be more inclusive, to excel and lead in their respective fields. equitable, and diverse. In an ambitious move to expand our impact beyond the As we look forward to the year ahead, we are filled with hope shores of the United States and Canada, we've taken a bold and excitement for what we can achieve together. Our work stand to address equity challenges for women across the is far from over, and we invite you to continue this remarkable globe. This year marked a significant milestone in our journey journey with us. Let's keep pushing boundaries, challenging"
5,RTC_Impact_Report_2023,3,"by opening our first international office in London. This new norms, and creating opportunities for women in tech across base serves as a beacon for our UK community, promising the globe. to offer the same support, opportunities, and network that Thank you for your continued support, dedication, and belief has been instrumental in the success of our members in in Rewriting the Code. Here's to another year of impact, North America. growth, and empowerment. Equally important has been our initiative to identify and support Native American women in tech intentionally. By empowering student leaders, connecting members to Native With heartfelt gratitude, American role models, and fostering connections among members who share a similar identity, we've taken another Sue Harnett step towards inclusivity and representation in the tech Founder & CEO industry. This initiative reflects our commitment to not only 3 rewritingthecode.org • info@rewritingthecode.org"
6,RTC_Impact_Report_2023,4,"Global Impact Expanding Our Impact Globally 2023 marked a milestone year for Rewriting the Code as we took a bold step beyond our US borders, launching our presence in the 2023 United Kingdom. This exciting expansion is part of our ongoing commitment to foster diversity and inclusivity in the tech world on a UK Highlights global scale. Our President and CEO, Sue Harnett, shares her enthusiasm: ""Our venture into the UK is more than just a geographical expansion – it's London Summer about intensifying our efforts to empower women in technology. Celebration event for UK We're bringing our rich resources, industry connections, and a interns & new grads hosted nurturing community to support university students and early-career at Palantir professionals in the UK's dynamic tech sector."" 3 Black History Month Leading our UK initiatives is Jessica Furness, who was appointed Program events as the UK Director. Jessica's profound understanding of the UK's"
7,RTC_Impact_Report_2023,4,"tech and recruitment landscape is key to developing meaningful Events and engagement partnerships with universities, tech companies, and organizations with 8 Women in STEM focused on diversity, equity, and inclusion. societies on campus Jessica reflects on this new journey: ""Being part of the global UK-specific programming Rewriting the Code community has always been about inclusivity and events to support and support. We're taking a step further to engage directly with our members’ job-seeking UK members. The tech industry here is booming, but ensuring women are integral to this growth is crucial. Our holistic approach supports Supported 25 members women at every stage of their tech journey, contributing to a more to attend in-person balanced and inclusive industry."" conferences free of charge 4 rewritingthecode.org • info@rewritingthecode.org"
8,RTC_Impact_Report_2023,5,"Global Impact We also welcomed Blessing Adogame as our UK Community Development Manager. A former RTC student member, Blessing's 35% journey with us has come full circle. She brings her experience with 1,000+ First RTC and a passion for guiding students towards achieving their Members Generation career aspirations. Students This expansion into the UK couldn't be more timely. The tech industry's call for diversity and representation is loud and clear. Our UK initiative aims to equip women with the necessary tools, support, and opportunities to excel in their tech careers while aiding UK tech 70 26% companies in achieving their diversity and inclusion objectives. Universities Black Represented Heritage Here's to a future where the tech industry's diversity mirrors the world it serves, and Rewriting the Code is at the forefront of this transformative journey. 5 rewritingthecode.org • info@rewritingthecode.org"
9,RTC_Impact_Report_2023,6,"Our Community 7,624 1,126 undergraduate graduate students students 28% YoY membership growth 4,500 14,284 BLNA early career members members 6 rewritingthecode.org • info@rewritingthecode.org"
10,RTC_Impact_Report_2023,7,"Community Student Community Top Colleges Top Summer Cities Top College Cities University of California-Berkeley New York New York Duke University San Francisco Boston Northeastern University Seattle San Francisco Cornell University Philadelphia New York University Atlanta Carnegie Mellon University Georgia Institute of Technology University of California-Los Angeles University of Pennsylvania Early Career Community Top 5 Tech Interests Top 5 Job Titles Top Early Career Cities Artificial Intelligence Software Engineer (39% of community) New York Data Science Product Manager San Francisco Machine Learning Data Scientist/Data Manager London Backend Development Web Development Seattle Big Data Cybersecurity Toronto BLNA Community 3,000+ members 1,300+ members 100+ members 300+ colleges + universities 250+ colleges + universities 24+ colleges + universities 7 rewritingthecode.org • info@rewritingthecode.org"
11,RTC_Impact_Report_2023,8,"Member Spotlight Layke Jones • RTC Black Wings 2023-2024 Leader • North Carolina A&T State University • Computer Graphics Technology Major • Class of 2026 From a young age, I've always known that I wanted to pursue a career in tech. However, given that the only DEI representation in STEM I ever witnessed was ‘Doc McStuffins,’ I assumed my chances of success were nonexistent. After joining Rewriting The Code, I quickly realized that constantly searching for depictions of minorities in tech was never the answer. Instead, I could become the representation I sought for all those years. Over the course of 2023, I've interned at my local Chamber of Commerce, volunteered for multiple organizations dedicated to uplifting children in STEM, and represented Black Queer bodies at the O4U Engineering Conference. I've been invited to several distinguished summits and events, selected to lead Black Wings as an RTC student leader, and much more."
12,RTC_Impact_Report_2023,8,"There is no community I love more than the one that has been built at Rewriting the Code. Here, I don't have to seek representation; all I have to do is open my eyes, and it's all around me!"" 8 rewritingthecode.org • info@rewritingthecode.org"
13,RTC_Impact_Report_2023,9,"2023 Impact 89% of members said RTC has TEAMRTC positively impacted their career (Data from 8/31/23 - 12/31/23) or life 32,963 platform job views $515,000 in funds distributed via the RTC 1,185 platform job favorites Women in Tech Fund 846 platform job applications 75% of RISE attendees feel more favorably about a company SLACK MEMBERS SERVED sponsor after attending one of their RISE sessions COMMUNITIES BY PROGRAM 10,466 79% 7,170 members of Spring 2023 grads secured RTC Events a full-time job (of those 38% 1,466 who reported) engagement rate RISE live events 60% 9,333 363 of new RTC members feel posts made Resumes Reviewed very certain they will pursue 229 a tech career. By 90 days into 16,739 Mentorship Matches their membership, 71% of RTC replies members feel very certain they 119 35,858 will pursue a tech career (of Women in Tech Fund reactions those who reported) Recipients 95 Conference Scholarships 91 Brilliant Black Minds Participants"
14,RTC_Impact_Report_2023,9,9 rewritingthecode.org • info@rewritingthecode.org
15,RTC_Impact_Report_2023,10,"What members say about the RTC community ""As a woman in tech attending a school not known for its computing program, I see RTC as the career center + community that I always wanted."" “It’s a great space where “RTC is a community you can connect with other like no other where women in tech no matter you truly feel a sense what part of your journey of belonging and you're on!” motivation to pursue a career in tech.” “This is a great community of super supportive and encouraging women who can “RTC has been instrumental in my really help you learn more career and journey as a young about what you can do in the woman in tech. RTC consistently tech space!” provides opportunities for women to gain access to the support and materials needed for success. I can ""If you hope to find always rely on the RTC community a safe space to be to connect with other women."" authentically yourself while doing what you love, RTC is the place for you.” 10 rewritingthecode.org • info@rewritingthecode.org"
16,RTC_Impact_Report_2023,11,"2023 Milestones RTC welcomed five new core staff members! Nicole Wright, Director of Partner Engagement Jessica Furness, Director of RTC UK Victoria Ewing, VP of Business Development Blessing Adogame, UK Community Development Manager Sidney Lopez, Member Programs & Leadership Manager Launched a new website celebrating the unique paths RTC women take toward their careers in tech Launched the Tech Natives community, creating a safe space for Indigenous and Native women as they navigate the tech industry Launched conference scholarships to help make Launched the RTC attendance more accessible community in the UK, for our BLNA community growing from 120 members to over 700 within six months Launched an enhanced version of our private platform, teamRTC, for members and partners, with an improved job board, mentorship module, and direct communication between recruiters and members 11 rewritingthecode.org • info@rewritingthecode.org"
17,RTC_Impact_Report_2023,12,"Programs and Events RTC Women in Tech Fund The Women in Tech Fund is a partnership funded by Goldman Sachs that offers financial support to undergraduate members, helping them overcome urgent financial obstacles. The fund awards support via an abundance, trust-based approach and has provided over $515k in financial support to more than 119 RTC members. The fund's impact grows as more partners join Goldman Sachs' initial philanthropic investment. RISE with RTC RTC’s 2023 holistic educational program offered 70 workshops across our 6 main educational pillars: Recruiting Success, Interest Exploration, Confidence & Self-Care, Career Acceleration, Tech Trends & Tools, and Financial Literacy. Over 1,400 women in tech engaged and benefitted from attending these programs live throughout the year, providing an average of 9/10 feedback scores! Black Wings Hacks More than 200 women participated in 12 educational workshops during our annual virtual"
18,RTC_Impact_Report_2023,12,"hackathon. The hackathon saw 140 hackers develop 26 projects, with 22 teams winning prizes sponsored by RTC partners. Women who attended the event described feeling ""empowered,"" ""valuable,"" ""powerful,"" and ""seen."" RTC Rising Leaders Institute The Rising Leader Institute enlisted 32 community members to strengthen our peer-to- peer programming and engagement. As a result, Rising Leaders supported programming efforts across 6 interest groups, contributed to ongoing conversations in our Slack community, and enhanced engagement opportunities at conferences and virtually during monthly member hangouts. Leaders also received a full menu of professional development opportunities to elevate their skills throughout their tenure. Summer Tech Hubs RTC women in San Francisco Bay, Silicon Valley, Seattle, and New York City hosted 26 in-person events throughout the summer. Over 600 members attended meet-ups and company-hosted socials, cultivating community and creating belonging for these interns"
19,RTC_Impact_Report_2023,12,and new grads. 12 rewritingthecode.org • info@rewritingthecode.org
20,RTC_Impact_Report_2023,13,"Virtual Career Summit Over 2,000 women from 450+ colleges and 15+ countries participated in the fourth-annual VCS and InclYOUsion Day events. Over two-thirds of the attendees attended without any cost. The events were sponsored by 31 companies directly engaging with emerging talent, hiring dozens of women in the following months! Member Surveys RTC surveys our members to help us best support our members and partners. In 2023, we ran Recruiting Experience and Internship Experience surveys that help RTC guide our company partners on best practices for recruiting and retaining women and give our members the data they need to make the best decisions for their career goals. RTC also runs monthly Pulse Surveys that have helped us deliver timely feedback to members and partners. Immersive Company Experiences RTC offers immersive company experiences where women visit professional campuses of company partners, connect with women engineers, and envision themselves adding value to each company."
21,RTC_Impact_Report_2023,13,"The Capital One Leadership Retreat empowered RTC’s Black Wings, Latinas de RTC, and Tech Natives Leaders to unite over 2 days at Capital One’s McLean, VA headquarters to engage in strategic planning and learning. Student Leaders participated in educational workshops hosted by Capital One experts and honed the leadership skills necessary to lead their respective communities effectively. The Goldman Sachs x RTC BootCamp Experience consisted of 6 weekly virtual sessions, culminating in a 2-day on-site experience at the Goldman Sachs NYC Headquarters. There, participants participated in personal and professional development panels and worked at the desk with Goldman Sachs engineers. Conference Scholarships Attending a professional technology conference remains one of the top goals expressed by RTC women. Unfortunately, with average conference costs exceeding $1,200 per person, attending a professional conference is often out-of-reach. RTC was proud to"
22,RTC_Impact_Report_2023,13,"support over 80 members attending 7 of the top professional tech conferences. Support for lodging, travel, meals, and registration fees valued at $55,000 was awarded to members in 2023. 13 rewritingthecode.org • info@rewritingthecode.org"
23,RTC_Impact_Report_2023,14,Partners Our partners make our impact possible. We are grateful for their generous support. Platinum Sponsors Gold Sponsors Silver Sponsors Bronze Sponsors * Outline indicates new partnerships in 2023 14 rewritingthecode.org • info@rewritingthecode.org
24,RTC_Impact_Report_2023,15,"Partner Spotlight In our journey toward fostering a diverse and inclusive workforce, Capital One's partnership with Rewriting the Code (RTC) stands as a testament to our commitment to social responsibility, creating a workforce that reflects the rich tapestry of our communities and driving innovations from diverse perspectives. At Capital One, we understand that a diverse talent pool is essential for creating transformative solutions that meet the evolving needs of our customers. Our partnership with RTC has been instrumental in enabling us to connect with a host of highly skilled and motivated individuals passionate about careers in technology. Through tailored sponsorship opportunities and events, we've engaged with RTC candidates, fostering meaningful relationships and providing them with exclusive insights into our culture and opportunities. These relationships resulted in nearly 35 RTC participants joining Capital One"
25,RTC_Impact_Report_2023,15,"as interns and full-time associates. Our support extends beyond recruitment. It encompasses empowering RTC students through programs like Black Wings Hacks, RTC Leadership Planning Retreat, IncluYOUsion Day and Kickback and the RTC Virtual Career Summit. By investing in these personal connections, we gain invaluable insights into the future workforce while fortifying our ability to retain exceptional women in tech. Together with RTC, we're driving meaningful change and shaping a more inclusive future for the tech industry. Our partnership with RTC aligns seamlessly with our commitment to social impact and diversity. Together, we're not only shaping the future of the tech industry but also fostering an environment where every voice is valued and every talent is nurtured.” — Chiara Barden - Program Lead for Students and Grads National Partnerships for Capital One 15 rewritingthecode.org • info@rewritingthecode.org"
26,RTC_Impact_Report_2023,16,"Our Vision for 2024 Heading into 2024, Rewriting the Code (RTC) is set to significantly scale our impact, building on seven years of dedication to enhancing the experiences of young women in technology. Our strategy encompasses: • Broadening Membership: We're extending our reach to support women technologists in the first six years of their careers, recognizing the critical early stages of professional development. • Global Expansion: After our successful launch in the UK and Ireland, we're leveraging our insights to support our members internationally. • Data Insights and Sharing: By analyzing and sharing member and company data, we aim to provide deeper insights into trends, challenges, and opportunities in the tech landscape. • Diverse Industry Partnerships: We're expanding our collaborations across sectors like healthcare, mobility, and entertainment, enriching our members' exploration and opportunities."
27,RTC_Impact_Report_2023,16,"• Deepening Equity Work: Our initiatives now include ESG, CSR, and philanthropy efforts within partner companies, aligning with our mission to foster equity in tech. With over 24,000 members from 110 countries, RTC is a trusted partner in women's career journeys in tech. Our work is supported by a network of tech companies, educational institutions, and organizations committed to dismantling gender inequality in the tech ecosystem. Launching our UK community and expanding partnerships signify our commitment to creating opportunities and fostering a supportive environment for women in tech globally. Our focus on sharing data insights and highlighting successful case studies aims to inform and inspire our community and partners. Looking ahead, we're poised to grow our community to 30,000 members by the end of 2024. Our initiatives, from mentorship to the Women in Tech Fund, are designed to support women at various stages of their tech journey, addressing the critical need for"
28,RTC_Impact_Report_2023,16,"increased representation and retention in the field. As we embark on this ambitious path, we invite our members, partners, and the broader community to join us in our commitment to equity in technology. Together, we can create a more inclusive and diverse tech industry. 16 rewritingthecode.org • info@rewritingthecode.org"
29,RTC_Impact_Report_2023,17,"Core Staff Jade Barricelli Kristin Austin, Ed.D. Erica Crutch Victoria Ewing SVP, Community + VP of Inclusion, Diversity, VP of Partner Engagement VP of Business Partner Programs Equity + Access Development Sammi Hermanski Lucille Tasker Christy Augsburger Nicole Wright Director of Member Sr. Director of Data Sr. Director of Marketing Director of Partner Programs + Events + Technology Engagement Jessica Furness Blessing Adogame Jessica Sherwood Angela Smith Director of RTC UK RTC UK Community Sr. Executive Assistant Sr. Information Technology Development Manager Manager Jasmine Lunceford Sidney Lopez Social Media + Member Programs & Community Specialist Leadership Manager 17 rewritingthecode.org • info@rewritingthecode.org"
30,RTC_Impact_Report_2023,18,"2023 - 2024 Board of Directors Roz Francuz-Harris Tracy Doaks Vice President of Talent Acquisition, President and Chief Executive Officer, Zillow MCNC Dr. Leah D. Houde Marykay Wells U.S. Chief Learning Officer, Chief Information Officer, PwC Pearson Peter Lange Anais Lawson Provost Emeritus and Professor, RTC Student Member Duke University Owen Astrachan Alice Wang Professor of Computer Science, RTC Student Member Duke University Myra Gupta Sue Harnett Forward Deployed Engineer, Founder & President, Palantir Rewriting The Code Robert (Rob) Fuentes Jade Barricelli Managing Director, CDIO Group Senior Vice-President, Community & Functions, Eng Lead HR, Comms & Partner Programs, Rewriting The Code Branding, Legal & Corporate Services UBS 18 rewritingthecode.org • info@rewritingthecode.org"
31,RTC_Impact_Report_2023,19,Student Leadership 2023-2024 RTC Black Wings Leaders Grace Coleman Layke Jones Ibukunoluwa Adeloye Leesel Fraser University of North Carolina North Carolina A&T Howard University The City University of At Chapel Hill State University New York 19 rewritingthecode.org • info@rewritingthecode.org
32,RTC_Impact_Report_2023,20,"Student Leadership 2023-2024 Latinas de RTC Leaders Nara Valera-Simeon Hailey Garcia Suli Caceres Ranilla University of North Carolina University of California, Columbia University Berkeley Christina Valtierra University of Texas at El Paso 20 rewritingthecode.org • info@rewritingthecode.org"
33,RTC_Impact_Report_2023,21,Student Leadership 2023-2024 RTC Tech Natives Kyra Kaya Madeline Gupta Yale University Yale University 21 rewritingthecode.org • info@rewritingthecode.org
34,RTC_Impact_Report_2023,22,Help Us Right the Ratio Become a Member Partner with Rewriting the Code Donate 22 rewritingthecode.org • info@rewritingthecode.org
35,RTC_Impact_Report_2024,1,SHAPING THE FUTURE OF TECH INNOVATION 2024 Impact Report 2024 Impact Report 1
36,RTC_Impact_Report_2024,2,"TABLE OF CONTENTS A Letter from Our Founder & CEO 3 Programs and Events 18 Our Mission, Vision & Values 5 Partnerships & Collaborations 25 Our Community 6 Looking Ahead - Our Vision for 2025 29 2024 Highlights & Achievements 11 2024 Staff, Board of Directors and 31 Student Leaders Community Impact & Member Stories 15 Get Involved 34 2024 Impact Report 2"
37,RTC_Impact_Report_2024,3,"LETTER FROM OUR FOUNDER & CEO Dear Rewriting the Code Members, Partners, and Supporters, As we close the chapter on an incredible 2024, I can’t help but reflect on the power of this community—on the resilience, brilliance, and determination of the women just beginning their technology careers. Last year, we expanded globally, exceeded expectations, and created new opportunities for each other. Every one of you gave to RTC — your time, expertise, stories, vision, and commitment to uplifting RTC members. What We Built in 2024 Bringing People Together: Growing Our Team, Growing Our Impact: This year, RTC hosted countless meetups, conferences, and campus events RTC welcomed six new team members in the U.S. and UK—each bringing across the UK, Ireland, Canada, and major U.S. cities like Boston, Charlotte, a wealth of experience, new ideas, and a deep understanding of what it"
38,RTC_Impact_Report_2024,3,"Chicago, New York City, Seattle, San Francisco, and Washington, DC. means to support women at the start of their technology careers. With their These weren’t just events. They were spaces where knowledge was shared, leadership, we’ve strengthened our global presence, reaching more women in mentorship flourished, and young women saw what was possible for the UK, Ireland, Canada, and beyond. their futures. Reaching New Heights: Listening & Learning: We set out to grow this community to 30,000 members, but we blew past We spent the year doing what great leaders do—we listened. Through that goal thanks to all of you. Today, 32,500 women are part of RTC— conversations, surveys, and deep discussions with our members and learning, growing, and shaping the future of tech. And this is just corporate partners, we learned what our women need to thrive in tech. And the beginning. we turned those insights into action—providing educational opportunities,"
