chunk_id,report_name,page_number,chunk_text
39,RTC_Impact_Report_2024,3,"career guidance, and hands-on support to help our members navigate an ever-changing industry. Expanding Our Circle: Change doesn’t happen alone. It happens when companies, leaders, and allies step up and commit to doing better. This year, more organizations joined our mission, opening doors for our members, offering mentorship, and providing career opportunities that wouldn’t have existed otherwise. We are grateful for these partnerships—but even more excited about what’s ahead. 2024 Impact Report 3"
40,RTC_Impact_Report_2024,4,"LETTER FROM OUR FOUNDER & CEO What’s Next for 2025? Technology is evolving rapidly, and we need to ensure that women aren’t just keeping up—we need to ensure they’re leading the way. That’s why we’re doubling down on skill-building in the fields shaping the future, from artificial intelligence to cybersecurity. We’re also strengthening our impact beyond education—deepening our work in workplace retention, corporate social responsibility, and philanthropy. Because this isn’t just about getting women in the door—it’s about making sure they thrive once they’re there. And with that vision in mind, we’re setting our sights on an even bigger goal: reaching 40,000 members by the end of 2025. This Is About All of Us I hope you take a moment to let the importance of this work sink in—to feel the power of what we’ve built together. Because none of this would be possible without you. The members who show up, work hard and dream big. The mentors who give their time and wisdom. The partners"
41,RTC_Impact_Report_2024,4,"and supporters who can translate academic frameworks to solutions that provide innovative solutions with technology. Thank you for everything you do. Thank you for believing in this mission. And thank you for being part of this journey. With tremendous gratitude, SUE HARNETT Sue Harnett FOUNDER & CEO 2024 Impact Report 4"
42,RTC_Impact_Report_2024,5,"OUR MISSION OUR VISION OUR VALUES Rewriting the Code is a 501(c)(3) We envision a world where women • Belonging & Community nonprofit dedicated to empowering in tech lead, innovate, and drive - Belonging is our bedrock. university students and early-career meaningful change. By preparing Community is our charge. women in tech. Through collaborative them for high-demand technologies, • Empowerment - We lift, lean on, learning and career-focused expanding global opportunities, and and leverage each other’s strengths. development, we foster belonging, leveraging data insights, we empower a • Access - Access should have no champion opportunity, and equip future future-ready workforce. Through career admission fee. innovators with the skills, knowledge, development and a commitment to • Impact - We develop future-ready and connections to thrive—reshaping social impact, we unlock technology’s talent prepared to shape and lead the future of technology. limitless potential. in tech."
43,RTC_Impact_Report_2024,5,"• Representation - We create RTC prepares the next generation mirrors and shatter glass ceilings. of tech talent to learn, innovate, and lead. 2024 Impact Report 5"
44,RTC_Impact_Report_2024,6,"COMMUNITY PROFILE As of 12/31/2024 10,027 35% undergraduate students first generation students 1,463 39% graduate students YoY membership 21,189 growth early career members 2024 Impact Report 6"
45,RTC_Impact_Report_2024,7,"1,881 351% undergraduate students YoY membership growth 362 1,859 graduate early career students members 2024 Impact Report 7"
46,RTC_Impact_Report_2024,8,STUDENT COMMUNITY Top Colleges Top Summer Cities Top Cities • Northeastern University • San Francisco • Boston • Georgia Institute of • New York • New York Technology • Seattle • San Francisco • University of Waterloo • Boston • Baltimore/Washington DC • New York University • Washington DC • Los Angeles • Columbia University • Toronto 2024 Impact Report 8
47,RTC_Impact_Report_2024,9,EARLY CAREER COMMUNITY Top 5 Tech Interests Top 5 Job Titles Top Cities • Software Engineering • Software Developer • New York City • Artificial Intelligence • Product Manager • San Francisco • Backend Development • Researcher • Seattle • Web Development • Data Scientist • London • Data Science • Project Manager • Boston 2024 Impact Report 9
48,RTC_Impact_Report_2024,10,"HIGHLIGHT: RTC UK BLACK WINGS LAUNCH UK Black Wings has launched, creating a dedicated space for Black women in tech to connect, collaborate, and thrive. With Black women making up less than 1% of the UK tech sector, the launch gathered 100+ women for two powerful events featuring industry leaders and community voices. This milestone builds a strong, supportive network to foster connections, career growth, and representation. With 33% of RTC UK members of Black Heritage, we honored UK Black History Month in October with events that empowered and uplifted our community. Members joined an exclusive networking breakfast at Black Tech Fest and attended Europe’s largest tech and culture festival. We also hosted community dinners nationwide, creating welcoming spaces for connection and celebration. 2024 Impact Report 10"
49,RTC_Impact_Report_2024,11,"2024 HIGHLIGHTS & ACHIEVEMENTS 95% of women feel certain about of members feel that RTC has 85.6% pursuing a career in tech positively impacted their student by graduation experience or career opportunities (2024 RTC Graduation Report) 89% 62.1% of respondents said of members said RTC has positively that RTC has positively impacted their career or life influenced their pursuit of a career in tech 255 events hosted 8,000+ RTC UK celebrated their event attendees one-year anniversary! $289,507 in funds distributed via the RTC Future of Tech Fund 2024 Impact Report 11"
50,RTC_Impact_Report_2024,12,"teamRTC Job Board Members Served Slack Communities by Program • 93,220 job views • 19,142 participants • 2,120 job favorites • 37% engagement rate • RTC Events: 8,000 • 1,636 job applications • 17,492 posts made • Resumes Reviews: 363 • 28,171 replies • Mentorship • 87,528 reactions Appointments: 432 • Future of Tech Fund Recipients: 108 • Leetcode Premium Recipients: 500 • LinkedIn Premium Recipients: 5,000 • Conference Scholarships: 85 2024 Impact Report 12"
51,RTC_Impact_Report_2024,13,"WHAT DO YOU VALUE MOST ABOUT THE RTC COMMUNITY? “Absolutely the community! “I love that it’s accessible to It’s incredibly supportive, empowering, students and is free. I have and uplifting. I wish I had discovered learned about tech opportunities it sooner for the self-confidence and that I wouldn’t have known about improvement it’s allowed me to achieve.” otherwise as a first-gen student.” “RTC has given me a lot more “Being able to see that success in confidence with my spot in tech. I tech is possible for me (even from always thought pre-RTC that I didn’t not a Top 10 school).” belong or should switch my major. I’ve gained a lot of confidence because of all the events that RTC has!” 2024 Impact Report 13"
52,RTC_Impact_Report_2024,14,RTC IN THE NEWS 2024 Impact Report 14
53,RTC_Impact_Report_2024,15,"COMMUNITY IMPACT & MEMBER STORIES CHARIS TRUSTY Student RTC Member since 2024 Drexel University / Computer Engineering “From an early age, I knew I wanted to Throughout the year, I developed a growth be a computer engineer. However, by mindset and my approach to things. I sophomore year, the lack of diversity in my learned critical skills like networking classes became increasingly apparent. In and self-belief, participated in my first many of my classes, I distinctly remember hackathon, attended multiple conferences, looking around the classrooms searching completed a successful co-op, and was for other women: only to find that I was selected for the Netflix x Formation boot the only woman in the room. The isolation camp program. and absence of representation made it challenging to envision my future in tech. RTC provided the community and encouragement I needed. I made In 2024, joining Rewriting the Code meaningful connections with fellow women"
54,RTC_Impact_Report_2024,15,"transformed my experience. I had the in tech and gained the confidence to create opportunity to attend the Goldman Sachs spaces for myself and others. If I could tell summit with RTC. This summit alone was my sophomore-year self one thing, it would a pivotal moment for me. I was inspired by be: ‘Keep going.’” successful women in tech, which motivated me to seize every learning opportunity. I saw how their unique journeys had developed them not only on a career level but on a personal level as well. I took their experiences as encouragement. 2024 Impact Report 15"
55,RTC_Impact_Report_2024,16,"LIZZY MAIR Early Career RTC Member since 2018 Senior Software Engineer “I joined Rewriting the Code in 2018 as an RTC gave me the confidence to prioritize finding undergraduate student with no prior work a female senior engineer to be my mentor at experience in tech. As a first-generation college Upside. She has been an invaluable guide, and student with a low-income background, I faced our biweekly check-ins have provided me with challenges navigating the industry. RTC and both encouragement and actionable insights. its vibrant community have been instrumental Connecting with other senior female leaders, in shaping my early career journey. Through whether engineers or in management, has also RTC, I connected with partner companies that been transformative. They helped me realize helped me secure both of my full-time jobs. I that I don’t have to put my life goals, like being also had the privilege of meeting and learning married, on hold, and their guidance has clarified"
56,RTC_Impact_Report_2024,16,"from many successful women in tech whose my values in both my career and personal life. stories and guidance inspired me to persevere. Without RTC, many of these connections would The resources offered by RTC, including events, have never been made. panels, and career exploration sessions, provided me with critical skills in recruiting, interviewing, My career journey hasn’t been without its negotiating, and self-advocacy. These skills not challenges. I’ve faced setbacks. Going from only helped me land my first promotion but also a large company to a startup, I had to quickly empowered me to confidently advocate adapt to using cloud technologies and learning for myself. Upside’s unique business model. Relocating to Washington, D.C. to be with my partner (now Today, I’m an active member of RTC’s Early husband), added another layer of adjustment. Career group, where I mentor collegiate members Despite these hurdles, the support of RTC kept"
57,RTC_Impact_Report_2024,16,"and engage in the Slack community. It has been me grounded. Knowing that there is a community incredibly rewarding to give back by sharing cheering me on and showing that the path in tech advice and experiences while continuing to is accessible and achievable has made all the learn from others. I’ve attended numerous virtual difference. RTC has not only shaped my career events, such as workshops on salary negotiations but also reinforced the importance of community and self-advocacy, which were transformative and perseverance in the face of challenges.” for my career development. My experiences with 2024 Impact Report 16"
58,RTC_Impact_Report_2024,17,"REGINA OSEI-BONSU United Kingdom RTC Member since 2023 Software Engineer “In 2023, I found myself searching for a new 6–10 of us have successfully landed new roles— women-in-tech community to join after the often one after another. How? By showing up for dissolution of SheCodes UK. That’s when I came each other. across Rewriting The Code through a LinkedIn post by Blessing, who was calling on Black RTC has taught me that it’s easier to go farther women in tech in the UK to celebrate Black when you go together. We support one another, History Month at Enish, a popular Black-owned and because of that, we all succeed together. restaurant. As a result, I’ve celebrated several personal wins Since attending that dinner, I’ve become an as an RTC member: active and integral part of RTC, both to learn and • I’ve made lasting friendships and professional to give back. You might wonder, why give back connections."
59,RTC_Impact_Report_2024,17,"over dinner? Well, that dinner alone allowed me • Hosted my first Pilates & Brunch event. to connect with like-minded people in different • Honed my content creation skills as part of areas of tech, which helped me expand my the social media team. network. Some of those connections have turned • Had the privilege of speaking at the World into close friendships, others into valuable Bank Youth Summit in Washington, D.C., on business relationships, and together we’ve built behalf of RTC. a powerful sisterhood. • Finally secured a new job, with the help and support of the community. This sisterhood has been instrumental in helping • Mentored an RTC member, helping them pass many of us navigate our biggest challenge: their technical assessment and secure a role. finding a job or a new job in the competitive and often unpredictable tech market. Through RTC has been more than just a community for upskilling together, studying together, hosting me—it’s been a space where I’ve been able to"
60,RTC_Impact_Report_2024,17,"events, and sharing job opportunities, a group of grow, connect, and thrive.” 2024 Impact Report 17"
61,RTC_Impact_Report_2024,18,"PROGRAMS AND EVENTS RTC FUTURE OF TECH FUND RISE WITH RTC The Future of Tech Fund is a partnership funded by Goldman RTC’s 2024 lineup offered members 30 workshops across our six Sachs that offers financial support to US and UK undergraduate main educational pillars: Recruiting Success, Interest Exploration, members, helping them overcome urgent financial obstacles. The Confidence & Self-Care, Career Acceleration, Tech Trends & Tools, fund awards support via an abundance, trust-based approach and and Financial Literacy. Over 2,000 women in tech engaged and has provided over $289K in financial support to RTC members. benefitted from attending these programs live throughout the The fund’s impact grows as more partners join Goldman Sachs’ year, providing an average of 9/10 feedback scores! initial philanthropic investment. 2024 Impact Report 18"
62,RTC_Impact_Report_2024,19,"Programs and events TECHCONNECT - SPRING RECRUITING BLACK WINGS HACKS The first annual TechConnect event successfully connected RTC More than 450 women participated in nine educational workshops members seeking job opportunities with hiring partners. With 457 and attended eleven company talks during our annual virtual attendees, including students and early-career professionals, hackathon. This year, the hackathon attracted 320 hackers, marking participants engaged in small-group sessions with recruiters. They a 129% increase from 2023, who worked together to develop 60 attended up to six 20-minute sessions to introduce themselves, projects. The women who attended the event expressed that they ask questions, and share their resumes. The event featured over felt “empowered,” “heard,” “powerful,” and “supported.” 25 open positions and met the needs of those still searching for opportunities. As a pilot program, TechConnect was successful and set the stage for expansion in 2025."
63,RTC_Impact_Report_2024,19,2024 Impact Report 19
64,RTC_Impact_Report_2024,20,"Programs and events CODEPATH X RTC TECHNICAL INTERVIEW PREP 25 TO F.I.N.I.S.H. INSTITUTE Powered by Reboot Representation and in partnership with The 25 to F.I.N.I.S.H. Institute guides Black, Latina, and Native/ CodePath, Rewriting the Code (RTC) supported a cohort of 73 Indigenous computer science women in the Class of 2025 through Black, Latina, and Native/Indigenous undergraduate women in a senior-year journey that integrates their personal and professional preparing for their tech careers. Participants completed CodePath’s identities, fostering agency, belonging, and persistence in tech. 10-week Technical Interview Prep course, complemented by Launched in October 2024, the inaugural program engages 75+ strategic peer support, exclusive in-person events, and dedicated college seniors across New York City, Boston, and Washington, Slack engagement. Notably, 57% of participants identified as DC. Participants attend bi-monthly virtual and in-person learning"
65,RTC_Impact_Report_2024,20,"first-generation students. The program demonstrated significant experiences focused on the F.I.N.I.S.H. pillars: Financial Knowledge, outcomes across all learning areas, including HackerRank Identity Exploration, Network Expansion, Inspiration, Software Skills, performance, increased confidence and sense of belonging in tech, and Health & Wellness. The program will culminate in an in-person and strengthened commitment to pursuing tech careers. graduation celebration in May 2025. 2024 Impact Report 20"
66,RTC_Impact_Report_2024,21,"Programs and events EARLY CAREER PROGRAMS SUMMER TECH HUBS In 2024, RTC Early Career Tech Hubs energized our mission to support early-career women in tech. Members in Boston, Seattle, and New York City hosted 49 events with nearly 600 attendees. From craft nights to restaurant meet-ups, these gatherings fostered With a grant from AffirmCares, Rewriting the Code’s Summer Tech community and connection. Hubs thrived in 2024 across six locations: Bay Area, New York City, and Seattle, and new hubs in Boston, Toronto, and London. RTC By partnering with dedicated volunteers, RTC is reinforcing ties in Summer Hub leaders organized 32 socials, welcoming about 300 these key areas. Through focused programming, we empower early- members and fostering community connections for tech interns. career women to thrive in tech careers, enhancing their sense of belonging. RTC’s partners enhanced these efforts with 16 tech crawls and five welcome events, drawing over 1000 attendees. Hosting"
67,RTC_Impact_Report_2024,21,"Emerging City Socials partners like Bank of America, Liberty Mutual, and others showed RTC expanded outreach to emerging global cities. In 2024, we hosted commitment to empowering the next generation of women in tech. 13 socials with 115 attendees in Philadelphia, San Francisco, Nashville, These events allowed members to cultivate networks, share Austin, and our early-career community in Nairobi, Kenya. These experiences, and gain insights for their tech careers. events show RTC’s commitment to fostering connection and growth for our members. The Download In May 2024, RTC launched The Download, a monthly virtual series to empower our Early Career community. These engaging sessions covered essential topics for women in tech, including Financial Literacy, “Bridging the Gap from Developer to Program Manager,” and “Navigating the Workplace with Confidence.” Across six sessions, The Download gathered 304 attendees, fostering conversations and"
68,RTC_Impact_Report_2024,21,providing actionable insights for their tech journeys. 2024 Impact Report 21
69,RTC_Impact_Report_2024,22,"Programs and events VIRTUAL CAREER SUMMIT UK CAREER SUMMIT Over 2,500 women from 400+ colleges worldwide participated In November 2024, Rewriting the Code hosted its first UK Career in the fifth-annual VCS and InclYOUsion Day events. 100% of the Summit, bringing together 60+ students in London alongside attendees attended without any cost to them. The events were GSK, Palantir, Bank of America, and Visa. RTC supported sponsored by 32 companies directly engaging with emerging students traveling from across the UK with financial stipends. talent, hiring dozens of women in the following months! The day featured a keynote by Founder & CEO Sue Harnett, upskilling sessions on personal branding and engineering at Palantir, discussions on Data Science careers, and CV reviews. Students connected with employers and each other during networking lunch and celebration drinks. 2024 Impact Report 22"
70,RTC_Impact_Report_2024,23,"Programs and events MEMBER RESEARCH & REPORTING CONFERENCE SCHOLARSHIPS RTC conducts surveys to better support members and partners. Attending a professional technology conference remains one In 2024, we launched the Recruiting and Internship Experience of the top goals expressed by RTC women. Unfortunately, with surveys to help guide best practices for recruiting and retaining average conference costs exceeding $1,200 per person, attending women, providing valuable data for our partners. a professional conference is often out-of-reach. RTC was proud to support over 85 members attending 5 of the top professional tech We also run monthly Pulse Surveys for timely feedback, allowing conferences. Support for lodging, travel, meals, and registration partners to prepare questions about the community, which we turn fees valued at $55,000 was awarded to members in 2024. into actionable insights. During Spring, Summer, and Fall, we distribute our Graduation"
71,RTC_Impact_Report_2024,23,"Survey to gather employment data and assess RTC’s impact on graduates, celebrating their achievements with stoles. Additionally, we conduct an annual Member Experience Survey to evaluate RTC’s impact and inform programming changes. 2024 Impact Report 23"
72,RTC_Impact_Report_2024,24,"Programs and events IMMERSIVE COMPANY EXPERIENCES RTC offers immersive experiences where members visit professional campuses of partner companies, connect with women engineers, and envision how they can add value to each organization. The Capital One Leadership Retreat brought together RTC’s Black Wings, Latinas de RTC, and Tech Natives Leaders for two impactful days at Capital One’s McLean, VA headquarters. Participants engaged in strategic planning, educational workshops led by Capital One experts, and leadership development designed to equip them to lead their communities effectively. The Goldman Sachs x RTC BootCamp Experience included six weekly virtual sessions, culminating in an engaging two-day on-site experience at Goldman Sachs’ NYC Headquarters. Participants participated in professional development panels, collaborated in teams to develop app pitches, and presented their innovative ideas to Goldman Sachs executives."
73,RTC_Impact_Report_2024,24,"The Palantir visit gave 30+ RTC members an exclusive opportunity to explore cutting-edge advancements in autonomous vehicle technology. Members observed the design, build, and testing processes through behind-the-scenes tours and hands-on technical demonstrations. They gained valuable insights into how drone and autonomous technologies drive innovation across industries. 2024 Impact Report 24"
74,RTC_Impact_Report_2024,25,"THE POWER OF PARTNERSHIP Pivotal Ventures fuels “Women have made large gains in women’s power and influence in the workplace; Rewriting the Code’s mission however, our research shows that women are more likely to face barriers and make tough trade-offs when advancing in their Pivotal Ventures, founded by Melinda French Gates, has careers. We are thrilled to provide the deepened its commitment to advancing women in technology necessary funding to support organizations by continuing to support Rewriting the Code. As part of who are helping to remove those barriers so Pivotal’s $150 million initiative to eliminate workplace barriers, women can thrive at work.” this investment enables RTC to expand its educational programming, enhance member support for women of diverse RENEE WITTEMYER backgrounds, and strengthen organizational capacity. Since its founding, Pivotal’s partnership with RTC has fueled a 30- VICE PRESIDENT OF PROGRAM STRATEGY, PIVOTAL"
75,RTC_Impact_Report_2024,25,"fold growth in membership, empowering tens of thousands of women worldwide to thrive in their tech careers. With Pivotal’s continued financial and strategic backing, RTC is poised to further its mission of creating lasting change in the tech 2024 Impact Report 25"
76,RTC_Impact_Report_2024,26,"THE POWER OF PARTNERSHIP How Duolingo partners with “With RTC, we’ve been able to RTC to increase the diversity find creative ways to interact and of their hiring pipeline actually build meaningful and trusting relationships with students.” Duolingo needed to increase candidate diversity in their BRITTANY MITLO university recruiting pipeline and reach more students year- round. They partnered with Rewriting the Code and used DIRECTOR OF UNIVERSITY RECRUITING, DUOLINGO the Virtual Career Summit and other events to connect with candidates and build long-term relationships. See their results 2024 Impact Report 26"
77,RTC_Impact_Report_2024,27,"THE POWER OF PARTNERSHIP Belvedere Trading is empowering the next gen of Fintech talent “The biggest benefit of working with Rewriting the Code has been the growth and traction and access to early career talent that we normally wouldn’t have.” LAUREN MASUD TALENT MANANGER, BELVEDERE TRADING 2024 Impact Report 27"
78,RTC_Impact_Report_2024,28,2024 PARTNERING ORGANIZATIONS Platinum Sponsors Gold Sponsors Silver Sponsors • Bank of America • Activision Blizzard King • Anduril • Netflix • Capital One • American Express • Belvedere • NVIDIA • Palantir Technologies • Goldman Sachs Trading • Reddit • Liberty Mutual • Datadog • Salesforce • Upside • Duolingo • Samsara • eBay • Sovos • Figma Compliance Bronze Sponsors • GoDaddy • Tradeweb • GSK • Two Sigma Philanthropic • Millennium • UiPath • Gusto Partners • Morgan Stanley • MOLG • Pure Storage • Reboot Representation • Pivotal Ventures 2024 Impact Report 28
