chunk_id,report_name,page_number,chunk_text
147,RTC_Impact_Report_2025,29,"9 2025 STAFF, BOARD OF DIRECTORS, AND STUDENT LEADERS CORE STAFF JESSICA FURNESS JADE BARRICELLI KRISTIN AUSTIN, ED.D. MONIQUE PEREZ LUCILLE TASKER CHIEF OPERATING SVP OF MEMBER VP OF CULTURE AND VP OF PARTNER VP OF DATA AND OFFICER EXPERIENCE SOCIAL IMPACT SUCCESS TECHNOLOGY CHRISTY SAMMI HERMANSKI NICOLE WRIGHT JESSICA RUSH JADE WRIGHT AUGSBURGER DIRECTOR OF SR. DIRECTOR OF DIRECTOR OF DIRECTOR OF GLOBAL VP OF MARKETING PROGRAM & EVENT PARTNER EXPERIENCE, PARTNER EXPERIENCE, LEARNING & UK+I OPERATIONS US/CAN UK&I INITIATIVES BLESSING ADOGAME ANGELICA NOVO JESSICA SHERWOOD ANATOLE NORLAND JASMINE LUNCEFORD UK&I PROGRAM PARTNER SUCCESS SR. EXECUTIVE DIRECTOR OF SOCIAL MEDIA MANAGER MANAGER ASSISTANT TECHNOLOGY & MANAGER INNOVATION SIDNEY LOPEZ, M.ED. ALLISON DARHUN GIULIANA GIDDINGS LYNNA RUSSELL SWADHA RAI STRATEGIC PARTNER CONTENT MARKETING BUSINESS LIFECYCLE DATA SCIENTIST II SR. PROGRAMS MANAGER DEVELOPMENT MARKETING MANAGER MANAGER MANAGER"
148,RTC_Impact_Report_2025,29,KATE DEAN-MCKINNEY JESSICA MORA FOLASAYO EMMA MURRAY DATA VISUALIZATION DATA ANALYST I OBAJULUWA PROGRAM & EVENTS DESIGNER TECHNICAL SUPPORT COORDINATOR SPECIALIST 29 REWRITINGTHECODE.ORG • 2025 IMPACT REPORT
149,RTC_Impact_Report_2025,30,"9 2025 STAFF, BOARD OF DIRECTORS, AND STUDENT LEADERS 2024-2025 BOARD OF DIRECTORS ROZ FRANCUZ- DR. LEAH HOUDE PETER LANGE OWEN ASTRACHAN ROB FUENTES HARRIS PARTNER, HEIDRICK & PROVOST EMERITUS PROFESSOR OF MANAGING DIRECTOR, VICE PRESIDENT OF STRUGGLES AND PROFESSOR, COMPUTER SCIENCE, CDIO GROUP FUNCTIONS • TALENT ACQUISITION, DUKE UNIVERSITY DUKE UNIVERSITY ENG LEAD HR, COMMS & BRANDING, LEGAL & ZILLOW CORPORATE SERVICES UBS MYRA GUPTA TRACY DOAKS MARYKAY WELLS JO(ANNE) ATLEE JOCELYN LAI FORWARD DEPLOYED PRESIDENT AND CHIEF CHIEF INFORMATION PROFESSOR AND GLOBAL HEAD OF ENGINEER, PALANTIR EXECUTIVE OFFICER, OFFICER, PEARSON DIRECTOR OF WOMEN TALENT ACQUISITION MCNC IN COMPUTER SCIENCE, & TALENT BRAND, UNIVERSITY OF DUOLINGO WATERLOO, CANADA CLARE GIFFIN-PASCOE ANAIS LAWSON ALICE WANG SUE HARNETT JESS FURNESS HEAD OF ENTERPRISE SOFTWARE ENGINEER, SOFTWARE ENGINEER, FOUNDER AND CEO, CHIEF OPERATING RISK & FINANCE MICROSOFT AFFIRM REWRITING THE CODE OFFICER, REWRITING"
150,RTC_Impact_Report_2025,30,"TECHNOLOGY, BANK * RTC EARLY CAREER * RTC EARLY CAREER THE CODE OF AMERICA REPRESENTATIVE MEMBER JADE BARRICELLI SVP OF MEMBER EXPERIENCE, REWRITING THE CODE 30 REWRITINGTHECODE.ORG • 2025 IMPACT REPORT"
151,RTC_Impact_Report_2025,31,"9 2025 STAFF, BOARD OF DIRECTORS, AND STUDENT LEADERS 2025 UK&I AMBASSADORS JANET ALEXANDRE AAGOON FAITH OMOTAYO NINA VARADARAJAN TEMITOPE ADEYELU CHAKRABORTY SAGAL UGAS OLUWASEUN LIYANS MATHEWS JENNIFER PHAM EMMA UNUODE ADEYEMO IMISI FAKUNLE BATUL CHEHAB 31 REWRITINGTHECODE.ORG • 2025 IMPACT REPORT"
152,RTC_Impact_Report_2025,32,"10 HELP US REWRITE THE FUTURE OF TECH HELP US REWRITE THE FUTURE OF TECH. Partner with Join Our Fund Programs Rewriting the Free Community and Volunteer Code Are you a student or early- Your time, expertise, and Partner with us to rewrite career woman exploring funding help fuel lasting the future of tech and connect a future in tech? Join our change. By donating or with top talent. Together, we free community for support, volunteering with Rewriting can fuel the future workforce networking, and access to the Code, you help remove and ensure women everywhere career opportunities. barriers, elevate talent, and have a powerful pathway into create long-term impact for meaningful, high-growth women in tech. tech careers. Partner with RTC Join our free community Donate Volunteer REWRITINGTHECODE.ORG INFO@REWRITINGTHECODE.ORG 32 REWRITINGTHECODE.ORG • 2025 IMPACT REPORT"
153,RTC_Internship_Report_2024,1,2024 INTERNSHIP EXPERIENCE REPORT
154,RTC_Internship_Report_2024,2,TABLE OF CONTENTS Introduction 03 Background 04 Key Insights 05 Insights: Internship Resources 06 Insights: Mentorship 07 Insights: Feedback 09 The Blueprint 10 About Rewriting the Code 12 Appendix 13
155,RTC_Internship_Report_2024,3,"Introduction THE INTERNSHIP EXPERIENCE: A 72% BLUEPRINT FOR SUPPORTING of members would accept a return offer WOMEN IN TECH 67% Internships are critical to the student experience, but how can of interns felt companies maximize the value of their program? supported by their mentor Aiming to gain insights into this and other questions, Rewriting the Code (RTC) surveyed RTC student members who had participated 69% in summer internships or co-op programs. Our primary goal was to assess their experiences, workplace dynamics, project alignment, mentorship, team interactions, compensation, and long-term career of interns were more certain certainty. about pursuing a career in tech post-internship This report highlights key findings in mentorship, project alignment, compensation, and career certainty, providing a data-backed blueprint for companies to develop stronger and more effective internship programs. 3 2024 Internship Experience Report"
156,RTC_Internship_Report_2024,4,"BACKGROUND RACIAL BREAK DOWN RTC surveyed members who secured a summer internship in 2024, collecting responses over three weeks via email and newsletter. Individuals could participate in the survey regardless of their internship role, company, or location. The survey was open for approximately three weeks and there were 604 total respondents. Data was analyzed to identify trends and insights while preserving individual confidentiality. Participants received a mix of multiple-choice, Likert-scale, and open-ended questions on the following topics. GRADUATION YEAR Survey Overview 36% Respondents: 604 RTC members (women in tech) Internship Details Work Setting: First-generation university students Work Authorization: Hybrid (minimum/specific 19% required a visa or days in office): 36% work authorization In-person: 30% 46% Hybrid (flexible remote/in- Internship Duration: person): 15% Median of 11 weeks Fully remote: 12% Attended top-ranked"
157,RTC_Internship_Report_2024,4,See appendix for more specific information. Computer Science schools 4 2024 Internship Experience Report
158,RTC_Internship_Report_2024,5,"KEY INSIGHTS Our analysis reveals three primary factors that are central to shaping an intern’s experience. Access to these factors can significantly impact an intern’s willingness to accept a return offer, while also playing a role in the individual’s desire to continue pursuing a career in tech. 1 2 3 The Right Quality Comprehensive Resources Mentorship Feedback Read on, as we dive into the role of resources, the importance of mentorship, and the value of feedback. 5 2024 Internship Experience Report"
159,RTC_Internship_Report_2024,6,"Insights 01/ RESOURCES ARE CRITICAL RESOURCES: THE IMPACT OF RESOURCE AVAILABILITY ON RETURN OFFER ACCEPTANCE Interns with access to structured resources, such as clear project timelines, system tutorials, and shadowing or networking opportunities, are significantly more likely to accept return offers. For respondents who did not have access to any of the resources surveyed, only 45% expressed a willingness to return to that employer. With just one resource in place, the likelihood of a return offer increases by at least 32%. And, with all of the supports in place, 92% of respondents said they would return for another internship. The significance can’t be overstated: making all of these resources available optimizes the intern experience. My internship was a valuable experience where setting clear expectations with my manager An average of 72% of interns accept a return offer. from the start proved essential. Regularly clarifying next steps and ensuring all questions"
160,RTC_Internship_Report_2024,6,were answered helped keep me on track. 6 2024 Internship Experience Report
161,RTC_Internship_Report_2024,7,"QUALITY MENTORSHIP HAS A 02/ SIGNIFICANT IMPACT ON THE INTERNSHIP EXPERIENCE Supportive Regular Career Mentorship Meetings Confidence 67% of interns with Weekly meetings Positively impacts mentors felt optimize tech career supported engagement certainty Mentorship can make or break an intern’s confidence in pursuing a tech career. We asked participants about the quality of support they received from their mentors and the frequency with which their mentors met with them. IMPACT OF MENTORSHIP ON TECH CAREER CERTAINTY Having engaged mentors meant that interns came away with more clarity Supportive mentorship Unsupportive mentorship in pursuing a career in tech. And the more supportive the mentors were, the more these interns expressed a willingness to accept a return offer with the organization. Some interns found their mentors’ engagement, communication, and support lacking and faced negative attitudes and behaviors. For these"
162,RTC_Internship_Report_2024,7,"women, their feelings around continuing on in their career can best be described as ambivalent. 50% 76% of students with of students with Whenever I had a question, [my supportive mentorship are unsupportive mentorship mentor] would tell me to Google it more certain about are certain about pursuing or use ChatGPT. pursuing a career in tech a career in tech 7 2024 Internship Experience Report"
163,RTC_Internship_Report_2024,8,"MENTORSHIP: THE IMPACT OF MEETING FREQUENCY ON RETURN OFFER ACCEPTANCE Mentorship matters, and having even more mentorship opportunities sets interns up for success. Out of those who reported having no mentors (and no meetings), only 58% would accept a return offer. Interns who met with a mentor at least once per week were 21 percentage points more likely to say they would accept a return offer than those who reported having no mentor. Consistent, structured mentorship, which includes meeting at least once a week, is key to keeping interns engaged and invested in returning. , , 8 2024 Internship Experience Report"
164,RTC_Internship_Report_2024,9,"FEEDBACK: THE IMPACT OF DIVERSE FEEDBACK ON RETURN OFFER ACCEPTANCE Feedback Sources: Mentors, Managers, Team Members, Coworkers COMPREHENSIVE FEEDBACK IS 03/ KEY IN PREDICTING THE LIKELIHOOD OF RETURNING TO A COMPANY Respondents were asked if they had received regular feedback on their work, and from whom. Interns who receive regular feedback from numerous sources, including mentors, managers, team members, and coworkers, are more likely to return. Of those who received feedback from all four sources, 94% said they would accept a return offer from the organization and 83% reported feeling more certain about pursuing I honestly love how my manager encourages a career in tech. us to share our ideas even if we challenge his own since he prefers receiving honest feedback to propel the business forward The trend is clear: the more touchpoints for feedback, the closer the instead of yes-men. intern’s connection to the company. If you want to boost intern"
165,RTC_Internship_Report_2024,9,"retention, you must create a culture of multi-source feedback. 9 2024 Internship Experience Report"
166,RTC_Internship_Report_2024,10,"The Blueprint for Strengthening Your Internship Program Provide Structured Resources Establish Consistent Mentorship Create Multi-Source Feedback Offer clear project timelines, shadowing Establish weekly mentor meetings, create Develop a culture where interns receive and networking opportunities, and compatible mentor/intern pairings, and train regular feedback from mentors, system tutorials and documentation to mentors to provide effective support and managers, team members, and help interns navigate their roles guidance. coworkers, establish a peer review effectively. system, and schedule reviews at regular intervals. 10 2024 Internship Experience Report"
167,RTC_Internship_Report_2024,11,"STRUCTURED RESOURCES of interns would return without resources 2024 Internship Experience Report tnioP gnitratS spetS noitcA emoctuO CONSISTENT COMPREHENSIVE MENTORSHIP FEEDBACK Interns want to learn, grow, and find inspiration 45% 40% 58% from the work and the people around them. They thrive with structured resources, quality mentorship opportunities, and feedback that’s of interns are less would accept a return certain of their place in offer with just a single both plentiful and relevant. By providing these tech feedback source resources to members, organizations are likely to see a higher rate of return offers and ensure that their interns feel supported and welcomed in tech. Establish weekly Implement a full Create system check-ins system of documentation These insights serve as a blueprint for a strong feedback Train mentors on internship program. Develop project effective support Create a peer timelines review system Pair mentors"
168,RTC_Internship_Report_2024,11,"Interns with just one of these steps Organize intern with compatible Schedule mid & networking implemented were 37% more likely to accept a interns endpoint reviews return offer than those with no steps taken. By implementing even just one of these action steps, your organization could see a significant 92% 76% 94% growth in intern satisfaction and retention, helping build a stronger, more engaged pipeline of interns with of interns will accept will accept a return supportive mentorship of future talent. a return offer with all offer with all feel more certain resources feedback sources about staying in tech 11"
169,RTC_Internship_Report_2024,12,"REWRITING THE CODE PREPARES THE NEXT GENERATION OF TECH TALENT TO LEARN, INNOVATE, AND LEAD. Investing in skill training, career readiness, and mentorship doesn’t just support your employees, it strengthens your entire talent pipeline. RTC makes it easier for you. Our community of over 35,000 students and early-career women in tech are actively upskilling, networking, and preparing for their future in tech. In fact, 95% of RTC members feel certain about pursuing a career in tech by graduation. Why not make their next career goal a position at your company? We are a 501(c)(3) nonprofit organization dedicated to empowering university students and early-career women in tech. Through collaborative learning and career-focused development, we foster belonging, champion opportunity, and equip future innovators with the skills, knowledge, and connections to thrive—reshaping the future of technology. Meet our global community at rewritingthecode.org 12 2024 Internship Experience Report"
170,RTC_Internship_Report_2024,13,"APPENDIX The survey included a mix of 604 total respondents Work Authorization multiple-choice, Likert-scale, and open-ended questions covering the Gender 19.04% leveraged a visa or other following topics: We polled “RTC members” (women) work authorization to take part in their internship Race Demographic Information: Race, We distributed the survey to all RTC ethnicity, anticipated graduation East Asian/Pacific Islander or Asian Work Setting members who had reported securing year, and international student American/Asian British - 34.10% a summer internship in 2024 and status South Asian or Indian Fully Remote - 11.59% invited respondents to participate via American/Asian British - 28.67% Remote (Occasional visits to the email/newsletter. Responses were Internship Details: Company, Black/African/Afro Caribbean or office) - 7.28% collected over a period of location, work setting (in-person, African American/Black British - Hybrid (Ability to choose in-"
171,RTC_Internship_Report_2024,13,"hybrid, or remote), duration, and 15.65% person and remote days) - approxmately 3 weeks. preparation resources White - 11.04% 14.57% Latina or Latina American - 8.07% Hybrid (Minimum/Specific days The survey was open to all eligible Internship Experience: Prefer not to say - 4.12% in office) - 36.26% members regardless of company, Middle Eastern or Arab American - In Person - 30.30% role, location, etc. Data was Role and responsibilities 2.31% aggregated to identify trends and Project alignment with career goals Other - 1.81% Internship Length Mentorship and manager/team Native American or Alaskan Native insights while preserving individual interactions - .33% Median - 11 weeks confidentiality. Intern programming and networking Black, Latina, and Native American Mean - 11.47 weeks opportunities - 23.68% Perceived impact of internship work First Generation College Student Definitions Compensation and Benefits: Hourly 35.93% pay, additional benefits (e.g., health Schools"
172,RTC_Internship_Report_2024,13,"insurance, stipends, PTO) Likelihood of return offer 45.86% attended a Top Ranked acceptance: the percentage of interns Future Career Intentions: Computer Science college or who, when asked if they were to Likelihood of returning to the university in their respective receive a return offer from their company (for the following college/university country internship company, indicated they summer or full-time), clarity of would accept it. return offer processes, and Grad Year interest in different career paths 2024 - 11.04% Supportive mentorship: consistent 2025 - 43.66% RTC Involvement: Participation in guidance, career advice, and 2026 - 32.95% RTC-sponsored events and engagement from their mentors. 2027 - 11.70% engagement with other interns 2028 - 0.66% 13 2024 Internship Experience Report"
173,RTC_Recruiting_Report_2025,1,REDEFINING GEN-Z RECRUITING: 2025 Recruiting Experience Report
174,RTC_Recruiting_Report_2025,2,2025 INDEX INDEX 03 04 05 EXECUTIVE DEMOGRAPHICS SECTION 1: SUMMARY APPLICATIONS 07 11 13 SECTION 2: SECTION 3: SECTION 4: PREPARATION INTERVIEWS RETURN OFFERS 17 20 23 SECTION 5: RENEGING NEW REALITY OFFER OF RECRUITING ACCEPTANCE & RTC MISSION 2
175,RTC_Recruiting_Report_2025,3,"2025 EXECUTIVE SUMMARY EXECUTIVE SUMMARY Recruiting is no longer just about filling roles. It’s about maximizing intern yield. Internships are the first real test of whether students see a company as transparent, supportive, and worth investing their careers in. This is the new reality of recruiting. In order to gain a deeper understanding of what students experience during the recruitment cycle, Rewriting the Code surveyed 3,400 students who participated in recruiting. We surveyed students not just to gather numbers, but to highlight what truly builds (or erodes) trust during recruiting. This report dives into each part of the recruiting experience, both an intern and new grad perspective, from application, preparation, interview, offer, and acceptance, with a close look at reneges. REWRITING THE CODE 3"
176,RTC_Recruiting_Report_2025,4,"2025 DEMOGRAPHICS DEMOGRAPHICS 31% 39% BLACK, LATINA, FIRST GENERATION NATIVE AMERICAN RTC surveyed 3,400 members who participated in The country representation of our respondents is as 30% 31% the 2024-2025 recruitment cycle. Individuals could follows (most to least represented): participate in the survey regardless of their internship • US: 84% role, company, or location and the survey was open for • CAN: 7% approximately 79 days to capture offers across the entire • IN: 3% recruiting timeline. Data was analyzed to identify trends • UK + I: 4% and insights while preserving individual confidentiality. REQUIRE US WORK ATTEND TOP CS The grad year representation of our respondents is as AUTHORIZATION UNIVERSITY follows (most to least represented): Participants received a mix of multiple-choice, Likert- • 2026: 37% scale, and open-ended questions on the following topics: • 2025: 33% 43% Application preparation, application strategy, interview SEEKING AN • 2027: 21%"
177,RTC_Recruiting_Report_2025,4,"preparation, specifics about roles receieved and renege INTERNSHIP • 2028: 6% decisions. Questions were opt-in, respondents were 31% • 2024: 2% not required to answer any question relating to thier ACCEPTED AN • 2029: 1% COHORT INTERNSHIP experience. 14% SEEKING NEW Right (L→R; T→B): BLNA (Black, Latina, Native American) percentage, We separated our respondents into two categories: GRAD ROLE first generation percentage, percent of respondents who needed work • Interns: Participating in internship, self-selected authorization in the United States, top ranked computer science school 12% • New grads: Heading into first full-time role post college percentage (see appendix for details), cohort definitions + percentages. ACCEPTED NEW GRAD ROLE REWRITING THE CODE"
178,RTC_Recruiting_Report_2025,5,"2025 APPLICATIONS E N O N O TI C E S APPLICATIONS How many applications are students submitting, and are they being selective? REWRITING THE CODE"
179,RTC_Recruiting_Report_2025,6,"2025 APPLICATIONS THE FIRST HURDLE Over-application is less about lack of focus and more What can your about fear and uncertainty. When students don’t hear back from companies or are unaware of company company do? timelines, students panic, leading to an increase in applications to raise their odds of securing an internship. You can’t eliminate all student stress, but you can This approach isn’t sustainable. Students are casting a wider net reduce uncertainty, which in turn lowers application volume and improves candidate quality. than ever before. It adds unneeded stress to companies, many of whose recruiting teams are already overworked. The increase in This can include: Rewriting the Code members have applied to more jobs applications makes it harder for organizations to find the • Providing application deadlines, interview in 2025 than in previous years (see graphic below). We right intern fit. timelines, and resources to company values and"
180,RTC_Recruiting_Report_2025,6,"asked members to rate themselves on a scale of very blogs from previous interns selective to not very selective. 45% of members listed The insight on RTC’s BLNA members’ greater selectivity • Automated follow-up emails once applications are themselves as “somewhat selective”. However, our BLNA adds an important nuance: while many students apply submitted respondents, who made up 31% of our sample, were 11% broadly, some groups place more importance on fit over • Insight into how the offer process generally works more selective than their peers, signaling a difference in volume. This reinforces that the recruiting experience is how identity factors into application behavior. not just transactional, it’s deeply personal. Members applied to more jobs in 2025 MEDIAN # OF JOB APPS SUBMITTED MEAN # OF JOB APPS SUBMITTED than in both 2024 and 2023. Compared to 2024’s median, interns are submitting 62 40 111133 112 12 more applications in 2025. The median number"
181,RTC_Recruiting_Report_2025,6,"of applications was 62, the mean was 113. For new INTERN grads, the median number was 40, the mean was 112. NEW GRAD"
182,RTC_Recruiting_Report_2025,7,2025 PREPARATION O W T N O TI C E S PREPARATION How are students preparing (and do they feel prepared) for interviews? REWRITING THE CODE
183,RTC_Recruiting_Report_2025,8,"2025 PREPARATION Top 5 AI uses during interview preparation: Interview preparation PREPARATION UNDER 58% PRESSURE Drafting cover letters Company research 26% 46% Students use the same methods to prep for interviews, but AI has moved up in the ranks. 57% Resume creation AI has officially entered the recruiting playbook, but it hasn’t replaced traditional preparation. While traditional tools such as solo LeetCode practice, 34% watching videos on interviewing, and mock interview practice are the top three interview preparation tools, fourth on our list was the use of AI. Open-ended application questions REWRITING THE CODE"
184,RTC_Recruiting_Report_2025,9,"v 22002255 PRREPEPOARRTATION THE OTHER SIDE: INSECURITY “I FEEL LIKE ONLY MY SKILLS, RESUME AND COVER LETTER ARE IN MY CONTROL. Our members state that their main priority Students believe the during the fall semester is school. However, recruiting process is largely INTERVIEWS SEEM BASED ON our accepted cohort is spending over 12 hours out of their control, and on coding assessments alone. Even with that dedication, just 32% of survey respondents feel LUCK AND HOW MUCH PREP they do not feel prepared prepared for them. enough. The 12+ hours spent doesn’t take into account TIME YOU HAVE.” the entirety of the application process, technical The second and third interview prep (40% of surveyed respondents most cited challenge with feel prepared for), behavioral interview prep, or company research; it isn’t surprising that students still seeking students are stressed out and the impact has a internships are Top 3 barriers for students still ripple effect in their lives."
185,RTC_Recruiting_Report_2025,9,"related to technical seeking roles: interviews. A common theme we have found is students just don’t feel prepared enough no matter how much 11. Not getting invited to interviews time they are dedicating, even though we know 22. Completion of technical interviews they are dedicating a significant amount of time 3. Lack of coding/technical interview experience 3 to the recruiting process, especially during the RREEWWRRIITTIINNGG TTHHEE CCOODDEE fall semester. 9"
